{
  "catalogue_version": "pilot-1.0",
  "channel": "pilot_staging",
  "checksum": "ec0163bbb867e7776c4915bdc14fbd85bd9287dd618257b6592415fda8ee4b94",
  "distribution_scope": "official_catalogue_release",
  "exercises": [
    {
      "anatomy": {
        "primary_muscles": [
          "pectoralis_major"
        ],
        "secondary_muscles": [
          "triceps_brachii",
          "deltoid_anterior"
        ],
        "stabiliser_muscles": [
          "rotator_cuff",
          "serratus_anterior"
        ]
      },
      "canonical_id": "bench_press",
      "classification": {
        "compound_or_isolation": "compound",
        "difficulty": "intermediate",
        "family": "chest_and_horizontal_pressing",
        "laterality": "bilateral",
        "movement_pattern": "horizontal_push"
      },
      "coaching": {
        "breathing_bracing": "Brace before the descent and release breath after the hardest portion of the press.",
        "common_errors": "Losing upper-back position or bouncing the bar.",
        "execution": "Lower the bar with control toward the chest then press to the start position.",
        "range_of_motion": "Use a controlled range that preserves the chosen upper-back and shoulder position.",
        "safety": "Use secure collars and appropriate rack safeties or a spotter for challenging loads.",
        "setup": "Set the upper back on the bench and plant the feet before unracking."
      },
      "display_name": "Barbell Bench Press",
      "equipment": {
        "attachments": [],
        "required": [
          "barbell",
          "bench"
        ]
      },
      "measurement_modes": [
        {
          "derived_metrics": [],
          "is_default": true,
          "load_semantics": "external_load",
          "measurement_schema_version": 1,
          "mode_id": "external_load_reps",
          "optional": [
            {
              "measurement": "rpe",
              "unit": "rpe_scale"
            }
          ],
          "required": [
            {
              "measurement": "load",
              "unit": "kilograms"
            },
            {
              "measurement": "reps",
              "unit": "count"
            }
          ]
        }
      ],
      "relationships": [],
      "search": {
        "aliases": [
          {
            "normalised": "bench press",
            "type": "search",
            "value": "Bench Press"
          },
          {
            "normalised": "flat bench press",
            "type": "search",
            "value": "Flat Bench Press"
          }
        ],
        "keywords": []
      }
    },
    {
      "anatomy": {
        "primary_muscles": [
          "quadriceps",
          "gluteus_maximus"
        ],
        "secondary_muscles": [
          "hamstrings",
          "hip_adductors"
        ],
        "stabiliser_muscles": [
          "gluteus_medius",
          "transverse_abdominis",
          "soleus"
        ]
      },
      "canonical_id": "ex_bulgarian_split_squat",
      "classification": {
        "compound_or_isolation": "compound",
        "difficulty": "intermediate",
        "family": "squat_and_knee_dominant_legs",
        "laterality": "unilateral",
        "movement_pattern": "lunge"
      },
      "coaching": {
        "breathing_bracing": "Brace before lowering and exhale as the front leg drives the body upward.",
        "common_errors": "Using the rear leg to push or choosing a stance that disrupts front-foot and knee control.",
        "execution": "Lower under control through the front hip and knee then drive through the front leg while maintaining balance.",
        "range_of_motion": "Use the range that preserves front-foot contact hip control and stable knee alignment.",
        "safety": "Confirm the bench is stable and avoid excessive pressure through the elevated rear foot.",
        "setup": "Place the rear foot lightly on a stable bench and adjust the stance so the front foot remains secure and balance is manageable."
      },
      "display_name": "Bulgarian Split Squat",
      "equipment": {
        "attachments": [],
        "required": [
          "bodyweight",
          "bench"
        ]
      },
      "measurement_modes": [
        {
          "derived_metrics": [],
          "is_default": true,
          "load_semantics": "bodyweight",
          "measurement_schema_version": 1,
          "mode_id": "bodyweight_reps",
          "optional": [
            {
              "measurement": "rpe",
              "unit": "rpe_scale"
            }
          ],
          "required": [
            {
              "measurement": "reps",
              "unit": "count"
            }
          ]
        },
        {
          "derived_metrics": [],
          "is_default": false,
          "load_semantics": "added_load",
          "measurement_schema_version": 1,
          "mode_id": "weighted_reps",
          "optional": [
            {
              "measurement": "rpe",
              "unit": "rpe_scale"
            }
          ],
          "required": [
            {
              "measurement": "load",
              "unit": "kilograms"
            },
            {
              "measurement": "reps",
              "unit": "count"
            }
          ]
        }
      ],
      "relationships": [],
      "search": {
        "aliases": [
          {
            "normalised": "bss",
            "type": "abbreviation",
            "value": "BSS"
          },
          {
            "normalised": "rear foot elevated split squat",
            "type": "search",
            "value": "Rear-Foot-Elevated Split Squat"
          },
          {
            "normalised": "rfess",
            "type": "search",
            "value": "RFESS"
          }
        ],
        "keywords": [
          "rear foot elevated lunge"
        ]
      }
    },
    {
      "anatomy": {
        "primary_muscles": [
          "forearm_flexors",
          "trapezius_upper"
        ],
        "secondary_muscles": [
          "gluteus_maximus",
          "quadriceps"
        ],
        "stabiliser_muscles": [
          "transverse_abdominis",
          "internal_obliques",
          "external_obliques",
          "gluteus_medius"
        ]
      },
      "canonical_id": "ex_farmers_carry",
      "classification": {
        "compound_or_isolation": "compound",
        "difficulty": "intermediate",
        "family": "core_and_carries",
        "laterality": "bilateral",
        "movement_pattern": "carry"
      },
      "coaching": {
        "breathing_bracing": "Breathe in controlled cycles while maintaining trunk tension rather than holding the breath for the full carry.",
        "common_errors": "Shrugging excessively or allowing lateral sway and uncontrolled steps as the loads drift from the body.",
        "execution": "Walk with natural controlled steps while keeping both loads close to the body then stop and set them down deliberately.",
        "range_of_motion": "Travel only as far as upright alignment secure grip and a stable gait can be maintained.",
        "safety": "Use a clear route and loads that can be picked up carried stopped and lowered without losing grip or posture.",
        "setup": "Stand between paired farmer handles and secure one load in each hand before establishing an upright braced posture."
      },
      "display_name": "Farmer's Carry",
      "equipment": {
        "attachments": [],
        "required": [
          "farmer_handles"
        ]
      },
      "measurement_modes": [
        {
          "derived_metrics": [],
          "is_default": true,
          "load_semantics": "external_load",
          "measurement_schema_version": 1,
          "mode_id": "loaded_distance",
          "optional": [
            {
              "measurement": "duration",
              "unit": "seconds"
            },
            {
              "measurement": "rpe",
              "unit": "rpe_scale"
            }
          ],
          "required": [
            {
              "measurement": "distance",
              "unit": "metres"
            },
            {
              "measurement": "load",
              "unit": "kilograms"
            }
          ]
        }
      ],
      "relationships": [],
      "search": {
        "aliases": [
          {
            "normalised": "farmer handle carry",
            "type": "search",
            "value": "Farmer Handle Carry"
          },
          {
            "normalised": "farmer walk",
            "type": "search",
            "value": "Farmer Walk"
          }
        ],
        "keywords": [
          "bilateral loaded carry",
          "grip carry"
        ]
      }
    },
    {
      "anatomy": {
        "primary_muscles": [
          "quadriceps",
          "gluteus_maximus"
        ],
        "secondary_muscles": [
          "hip_adductors",
          "hamstrings"
        ],
        "stabiliser_muscles": [
          "transverse_abdominis",
          "spinal_erectors",
          "forearm_flexors"
        ]
      },
      "canonical_id": "ex_goblet_squat",
      "classification": {
        "compound_or_isolation": "compound",
        "difficulty": "beginner",
        "family": "squat_and_knee_dominant_legs",
        "laterality": "bilateral",
        "movement_pattern": "squat"
      },
      "coaching": {
        "breathing_bracing": "Brace before lowering and exhale through the ascent while keeping the load close.",
        "common_errors": "Letting the load drift forward or allowing grip and upper-body fatigue to disrupt posture.",
        "execution": "Lower through controlled hip and knee flexion then stand while keeping the load close to the body.",
        "range_of_motion": "Use the depth that preserves whole-foot pressure and controlled hip knee and torso positions.",
        "safety": "Choose a load that can be securely lifted into position and held without obscuring foot placement.",